{
  "title": "My First Coloring Book: Animals",
  "book_id": "drawing-animals",
  "age_range": "2-3",
  "developmental_focus": "Fine-motor coloring practice (whole-hand/early tripod crayon grasp) paired with familiar animal vocabulary, pairing well with the fully-illustrated My First Animal Sounds book (same 2-3 age band) by giving the same familiar animals as coloring outlines instead of finished color art.",
  "trim_size": {
    "width_in": 8.27,
    "height_in": 11.69
  },
  "print_spec": {
    "dpi": 300,
    "bleed_in": 0.125,
    "color_mode": "CMYK"
  },
  "font_spec": {
    "primary_font": "Fredoka",
    "fallback_font": "Nunito",
    "min_point_size": 28
  },
  "total_pages": 10,
  "color_palette": "primary",
  "safety_notes": [
    "One animal per page, single simple black-line outline on white, no fine internal detail that would frustrate an early crayon grip.",
    "All animals depicted in friendly, non-threatening poses (no roaring/aggressive poses), consistent with My First Animal Sounds.",
    "Line art only, no pre-filled color -- coloring is the point of this book."
  ]
}
