{
  "title": "My First Coloring Book: Fruits",
  "book_id": "drawing-fruits",
  "age_range": "2-3",
  "developmental_focus": "Fine-motor coloring practice (whole-hand/early tripod crayon grasp) paired with fruit vocabulary. Thick, bold outlines only -- no fine detail or small enclosed regions, since 2-3 year olds color broadly and outside the lines, not precisely.",
  "trim_size": {
    "width_in": 8.27,
    "height_in": 11.69
  },
  "print_spec": {
    "dpi": 300,
    "bleed_in": 0.125,
    "color_mode": "CMYK"
  },
  "font_spec": {
    "primary_font": "Fredoka",
    "fallback_font": "Nunito",
    "min_point_size": 28
  },
  "total_pages": 10,
  "color_palette": "vibrant",
  "safety_notes": [
    "One fruit per page, single simple black-line outline on white, no fine internal detail that would frustrate an early crayon grip.",
    "No small enclosed regions (e.g. tiny seeds) that are impossible for a 2-3 year old to color inside of.",
    "Line art only, no pre-filled color -- coloring is the point of this book."
  ]
}
