{
  "title": "My First Animal Sounds (Part 2)",
  "book_id": "animal-sounds-part-2",
  "age_range": "2-3",
  "developmental_focus": "Vocabulary explosion + auditory-verbal imitation, continuing from Part 1 with 8 additional animals and their sounds.",
  "trim_size": {
    "width_in": 8.27,
    "height_in": 11.69
  },
  "print_spec": {
    "dpi": 300,
    "bleed_in": 0.125,
    "color_mode": "CMYK"
  },
  "font_spec": {
    "primary_font": "Fredoka",
    "fallback_font": "Nunito",
    "min_point_size": 28
  },
  "total_pages": 10,
  "color_palette": "primary",
  "safety_notes": [
    "One animal, one clear scene, one sound word per page -- no split-panel or multi-element compositions.",
    "Bear depicted as a smiling, non-threatening cub, never a roaring/aggressive adult pose.",
    "No animal shown in a predatory, aggressive, or frightening pose; all animals smiling/friendly and clearly safe for a toddler audience.",
    "Part 2 of an open vocabulary set -- no sequencing dependency on Part 1, can be read in any order.",
    "Images not yet generated -- this is a planned book; run the generate-book-images workflow and review before publishing."
  ]
}
