{
  "title": "My First ABC Tracing",
  "book_id": "drawing-abc-letters",
  "age_range": "2-3",
  "developmental_focus": "Pre-writing motor practice using letterforms as large traceable shapes. Note: independent controlled letter tracing is typically a 3.5-4+ year skill; at 2-3 this book is meant for hand-over-hand tracing with a caregiver (finger or crayon), not independent correct-stroke handwriting practice.",
  "trim_size": {
    "width_in": 8.27,
    "height_in": 11.69
  },
  "print_spec": {
    "dpi": 300,
    "bleed_in": 0.125,
    "color_mode": "CMYK"
  },
  "font_spec": {
    "primary_font": "Fredoka",
    "fallback_font": "Nunito",
    "min_point_size": 28
  },
  "total_pages": 28,
  "color_palette": "primary",
  "safety_notes": [
    "Content generated programmatically (code, not AI image generation) for pixel-precise letterforms -- no AI content-safety review needed for this book.",
    "Intended for hand-over-hand caregiver-assisted tracing at this age, not independent correct-stroke handwriting practice.",
    "One large traceable letter per page, extra-thick and simplified, with a small solid reference badge in the corner."
  ]
}
