{
  "title": "My First Coloring Book: Animals (Part 2)",
  "book_id": "drawing-animals-part-2",
  "age_range": "2-3",
  "developmental_focus": "Fine-motor coloring practice (whole-hand/early tripod crayon grasp) paired with animal vocabulary, continuing from Part 1 with 8 additional animals.",
  "trim_size": {
    "width_in": 8.27,
    "height_in": 11.69
  },
  "print_spec": {
    "dpi": 300,
    "bleed_in": 0.125,
    "color_mode": "CMYK"
  },
  "font_spec": {
    "primary_font": "Fredoka",
    "fallback_font": "Nunito",
    "min_point_size": 28
  },
  "total_pages": 10,
  "color_palette": "primary",
  "safety_notes": [
    "One animal per page, single simple black-line outline on white, no fine internal detail.",
    "All animals depicted in calm, friendly, standing/sitting poses -- no aggressive or predatory poses, consistent with Part 1.",
    "Bear depicted as a friendly, non-threatening cub silhouette.",
    "Line art only, no pre-filled color -- coloring is the point of this book.",
    "Part 2 of an open vocabulary set -- no sequencing dependency on Part 1, can be read/colored in any order."
  ]
}
