{
  "title": "My First Coloring Book: Fruits (Part 2)",
  "book_id": "drawing-fruits-part-2",
  "age_range": "2-3",
  "developmental_focus": "Fine-motor coloring practice (whole-hand/early tripod crayon grasp) paired with fruit vocabulary, continuing from Part 1 with 8 additional fruits. Thick, bold outlines only -- no fine detail or small enclosed regions.",
  "trim_size": {
    "width_in": 8.27,
    "height_in": 11.69
  },
  "print_spec": {
    "dpi": 300,
    "bleed_in": 0.125,
    "color_mode": "CMYK"
  },
  "font_spec": {
    "primary_font": "Fredoka",
    "fallback_font": "Nunito",
    "min_point_size": 28
  },
  "total_pages": 10,
  "color_palette": "vibrant",
  "safety_notes": [
    "One fruit per page, single simple black-line outline on white, no fine internal detail that would frustrate an early crayon grip.",
    "No small enclosed regions that are impossible for a 2-3 year old to color inside of.",
    "Line art only, no pre-filled color -- coloring is the point of this book.",
    "Part 2 of an open vocabulary set -- no sequencing dependency on Part 1, can be read/colored in any order."
  ]
}
